,title,company,salary,summary
0,Expert Flutter Developer (Cross-Platform),Mega Style Apartments,"₹40,000 - ₹60,000 a month","We run a fully furnished apartments company that rents out 1,2 3- and 4-bedroom apartments to short-term (days/weeks) and long-term (months) leisure and…"
1,Senior UI Developer,Design Everest,"₹19,42,000 a year",Our proprietary software 'Design Hub' allows us to start working on a home remodeling or construction project leveraging the cloud.
2,Flutter Developer,Presear Softwares PVT LTD,"₹60,000 - ₹70,000 a month","Collaborate with team members (product managers, developers, designers) to brainstorm about new features and functionalities."
3,Flutter Developer,Latent Bridge,"₹18,00,000 a year","The candidate should have mandatory exp in UI/UX.*.Job Types: Full-time, Regular / Permanent."
4,Flutter Developer,Infosys Limited,,"A day in the life of an Infoscion • As part of the Infosys Delivery team, you will work on implementing designs, developing high quality programs and systems,…"
5,Flutter Developer,Evocon Technologies,"₹25,000 - ₹55,000 a month",1.5 - 2 years of experience in Android & iOS apps development using Flutter.Design and build advanced cross-platform/hybrid applications using Flutter for…
6,Flutter Developer Intern,White Vectors,"₹15,000 a month",We need a flutter developer intern for our organization. Please share your LinkedIn and GitHub profile links along with resume. Job Type: Internship…
7,Flutter Developer,Ice Cubes Technologies LLP,"₹2,00,000 - ₹3,00,000 a year",You will be building and shipping robust apps to Android/ iOS devices using a single codebase.You will be writing readable and clear code using Dart that will…
8,Flutter Developer,RayyTech,"₹15,000 a month","Should have 0-1 year of experience.. Experience in both frontend and backend.Job Types: Full-time, Regular / Permanent, Contractual / Temporary, Fresher."
9,Flutter Developer for Android and IOS,Varthagam Software Technologies Pvt Ltd,"₹25,000 - ₹40,000 a month",Develop Mobile applications on mobile platforms like Android / iOS.Use Flutter knowledge to implement APIs in the app.Use Flutter for iOS development.
10,Flutter Developer,Vish Gyana Technology Solutions Private Limited,"₹12,00,000 a year",Develop and Design Mobile App using Flutter.Understand the design given by UI/UX team and design the same.Understand the concept/task completely and develop…
11,Flutter Developer,Hawkshaw,"₹2,80,000 - ₹3,20,000 a year","Experience working with remote data via REST and JSON.Experience with third-party libraries and APIs.Working knowledge of the general mobile landscape,…"
12,Flutter Developer,Grootan Technologies Pvt Ltd,"₹4,00,000 - ₹7,00,000 a year",Ability to develop custom flutter plugins.Has experience in working with any flutter state management solutions.
13,Flutter Developer,Collabera Services Private Limited,"₹15,00,000 a year",Flutter developer who is proficient in the dart.The primary focus will be on developing user interface components and implementing them by well-known Flutter…
14,Flutter Developer,Trancis Consulting services,"₹7,00,000 a year","Collaborate with team members (product managers, developers, designers) to brainstorm about new features and functionalities."
15,Flutter Developer,Indus Net Technologies,,Design and Build sophisticated and highly scalable apps using Flutter.Build custom packages in Flutter using the functionalities and APIs already available in…
16,IOS / Flutter Developer,KIRSHI TECHNOLOGIES AND CONSULTING PVT LTD,"₹3,14,072 - ₹7,20,000 a year","To build cross platform mobile apps for Android, IOS and native also.IPhone and iPad apps having extensive experience with Cocoa, Objective C and Swift, Swift…"
17,Flutter Developer,Luminosoft Technology Solution,"₹12,297 - ₹56,825 a month","6.Algorithm and Data Structure.Job Types: Full-time, Part-time, Regular / Permanent, Contractual / Temporary, Freelance, Volunteer, Internship, Fresher."
18,Flutter Developer,Tamavera services private limited,"₹4,00,000 - ₹12,00,000 a year",Flutter frame work: 1 year (Preferred).Very good understanding of Flutter framework at-least 1 year of experience in Flutter based application development.
19,Flutter Developer,ITC Infotech India Ltd,,Proficiency in mobile app development using OutSystems.Experience in working with REST APIs/web services and developing offline features in mobile app.
20,Flutter Developer,ToXSL Technologies Pvt. Ltd.,"₹2,00,000 - ₹5,00,000 a year",You can directly come for Walk-in Interviews.Freshers with 6 months of training can also apply.Experience working with Android and its API.
21,Flutter Application Developer,PSK Technology,"₹11,399 - ₹38,881 a month",Fresher and Experienced both candidates can apply*.Final year degree students also can apply*.Starting salary for experience will be based on their last…
22,Flutter Developer (2 years Experience required),nScript Technologies PVT LTD,"₹30,000 a month",Design and Build sophisticated and highly scalable apps using Flutter.Build custom packages in Flutter using the functionalities and APIs already available in…
23,Sr. Flutter Developer,Bluelupin Technologies,,"Skills: Android, Flutter Location: Noida Why Us? Flexible timings Exposure to latest technologies Work from Home facility Very Convenient location - Office is…"
24,Flutter Developer,Satvat,"₹1,75,000 - ₹4,75,000 a year",Should design and develop advanced applications in the flutter platform.Should have Experienced in handling User-friendly UI based on requirements in Flutter.
25,Flutter Developer – Intern,Intellect Logic softwares,,Design and Build sophisticated and highly salable apps using Flutter.Translate and Build the designs into high quality responsive UI code.
26,Urgent Job Opening For Flutter Developer,Promotup HR Solutions,"₹50,000 - ₹70,000 a month",*Company Name: *Promotup HR Solutions *Company Website* : http://www.promotuphr.com/ Interested Candidate Can Share There C.V On *Whatsapp : -* 7227011224 …
27,Flutter Developer,Brainium Information Technologies Pvt. Ltd.,"₹20,000 - ₹50,000 a month","Job Types: Full-time, Regular / Permanent, Fresher.Hyderabad, Telangana: Reliably commute or planning to relocate before starting work (Required)."
28,Flutter Developer,Collabera Services Private Limited,"₹15,00,000 a year",Flutter developer who is proficient in the dart.The primary focus will be on developing user interface components and implementing them by well-known Flutter…
29,Sr. Flutter Developer,SMCM technologies Pvt. Ltd.,"₹30,000 - ₹45,000 a month","Solid understanding of Flutter, Dart, Flutter animations.Should have experience working with Flutter state management approaches like BlOC, GetX, Provider etc.…"
30,Flutter Developer,Smarther,"₹11,216 - ₹54,654 a month",Understand the concept/task completely and develop the application.Understand the Boilerplate Code Standard and Develop the app.Good Knowledge of Java / Dart.
31,Freelance Mobile App Developer,YellowThemez,"₹25,000 a month","Looking for experienced mobile app developers with knowledge on flutter.Job Types: Part-time, Contractual / Temporary, Freelance."
32,Flutter App Developer,iStudio Technologies,,"Flutter: To build cross platform mobile apps for Android, IOS and Web.This should include from making responsive UIs to efficiently query data and also mange…"
33,Flutter / React Native Developer (Work from home),EmerX Services Pvt. Ltd.,"₹1,20,000 - ₹5,50,000 a year",The front end developer will also be responsible for creating innovative solutions to mobile app design issues to help make the mobile apps more visually…
34,Flutter Mobile Applications Developer - India,Alertus,,Fix bugs through problem recreation and resolve software defects.Perform platform-specific and cross-platform mobile applications development with iOS &…
35,Android Developer,Elitez India,"₹20,000 - ₹50,000 a month",Job Type: *Full time/Permanent.The candidate should have 2+ years of experience developing Android Apps.The candidate should have a bachelor’s degree in CSE…
36,Flutter Developer,Daily Doc healthcare,"₹3,00,000 - ₹10,00,000 a year","Cross-platform mobile app developers who have developed mobile apps with familiarity with Flutter.With advancements in technology, communication in healthcare…"
37,Flutter Developer - Intern,Regami Solutions,"₹5,000 a month","Our services have applicability across use cases such as Medical Devices, Industrial IoT, Medical IoT, Smart Surveillance, Security, Biometrics, Machine–Vision,…"
38,Flutter Mobile App Developer,Kriya Tec IT Systems,"₹7,00,000 a year",Job type: Full time/ permanent job.Hands on experience in both Android and IOS.Design and Build sophisticated and highly scalable apps using Flutter.
39,Flutter Developer,Florisys Private Limited,"₹16,143 - ₹77,302 a month","In this role, you will work throughout the software development lifecycle, performing design, code, debug, maintain, test, implement and validate mobile…"
40,Software Developer (Freshers),FindingPi Pvt Ltd.,,"Analyze and maintain existing software applications.Design highly scalable, testable code.Discover and fix programming bugs."
41,Software Developer,Attica Digital Gold Pvt Ltd,"₹20,000 - ₹35,000 a month",Demonstrate up to date expertise in Agile Software Engineering practices and Computer Science and apply it to development of cutting edge applications…
42,Flutter Developer,Futurehook Technologies,"₹3,00,000 - ₹8,00,000 a year","Expertise in handling user-friendly UI based on requirements in flutter.Handling location services, notifications, rest APIs, 3rd party integrations in flutter…"
43,FLUTTER DEVELOPER,Cybrain Software Solution,,"Collaborate with team members (product managers, developers, designers) to brainstorm about new features and functionalities."
44,Flutter Developer,KS Smart Solutions Private Limited,"₹3,70,461 - ₹6,50,000 a year",_Aavin: _ We deployed an integrated Inventory Management System and Pos machines to keep track of stock and refill along with automating payments through…
45,Mobile Application Developer,The mobily Technologies,"₹70,000 a month",Have two or more iOS/Android apps developed with Flutter.Either deployed on the AppStore/Google Play.2+ years in mobile software development;
46,Flutter Developer,aTeam Soft Solutions,"₹4,00,000 - ₹9,50,000 a year",Experience with Android Native or IOS Native.Solid production experience with applications related to Flutter.Able to provide proof of previous work.
47,Android Developer / Flutter Developer,SECRET TECHNOLOGIES INDIA VMS GROUP,"₹15,000 - ₹54,200 a month",You will be building and shipping robust apps to Android/ iOS devices using a single codebase.You will be writing readable and clear code using Dart that will…
48,Flutter developer,"Stefanini, Inc",,You will also work closely with your product owner and a team of other software engineers to ensure that the features you're delivering meet our industry…
49,Flutter Developer,iDreamCareer,,We are looking for a Mobile App Developer having experience in Flutter and Dart(minimum 1.5 years).Use the BLoC pattern to keep a separation between logic and…
50,Flutter Developer,Whizzact,"₹2,59,442 - ₹11,85,706 a year",Design and Build sophisticated and highly scalable apps using Flutter.Build custom packages in Flutter using the functionalities and APIs already available in…
51,Flutter App Developer,Swadesh Softwares,,"1.5-2 years(1.5 years in Flutter).Experience in developing hybrid apps for iOS and Android platforms using Flutter, Angular4, HTML5, CSS3, Bootstrap,…"
52,Flutter Developer,Deeprooted,"₹2,50,000 a month",\* Experience with developing customer facing performant and intuitive mobile apps.\* Experience with HTTP Protocol/Rest API - understand interaction nuances…
53,Software Developer,Industrial Support Services,"₹25,000 - ₹60,000 a month","We have Openings for iOS, PHP Laravel, Flutter, Dot net, React Native.*.Should have good experience in any above domain.React Native: 1 year (Preferred)."
54,Mobile iOS Developer,Conquest Tech Solutions Inc,"₹10,50,000 - ₹18,50,000 a year",Mobile app developer profiles with 6+ years of relevant experience and having Flutter experience.Only *IOS* and *flutter* experience profiles.
55,Flutter Developer,SuperLabs,"₹70,000 - ₹1,20,000 a month","Someone who is passionate about code writing, solving technical errors and taking up full ownership of app development.Expectations in the first six months."
56,Flutter Developer,Intelizest Consulting Private Limited,"₹11,216 - ₹54,622 a month",Must have Minimum 1+ years of experience in Flutter with dart.Total 4+ years of relevant hands-on software engineering experience building Web / Mobile App.
57,Flutter Developer,India Health Link pvt ltd,"₹20,000 - ₹50,000 a month",Should have experience in one flutter mobile application development which is published in play store or App store.Experience in REST API integration.
58,Flutter Developer,MERAS PLUGINS,"₹7,00,000 - ₹10,00,000 a year",MERAS Plugins is looking for a hardcore Flutter Mobile developer who will be involved in building highly scalable and performant Mobile applications for the…
59,Flutter Developer,Collabera Services Private Limited,"₹15,00,000 a year",Flutter developer who is proficient in the dart.The primary focus will be on developing user interface components and implementing them by well-known Flutter…
